{
  "$schema": "../../schemas/crt_profile.schema.json",
  "id": "generic-pvm",
  "display_name": "Generic PVM-class monitor (testing baseline)",
  "era": "1990",

  "tube": {
    "mask_type": "aperture_grille",
    "dot_pitch_mm": 0.25,
    "screen_curvature": "flat",
    "diagonal_inches": 14,
    "aspect_native": "4:3",
    "source": {
      "url": "https://crtdatabase.com/crts/sony/sony-pvm-14m2u",
      "retrieved_at": "2026-05-27",
      "notes": "Synthesised baseline that emulates the typical 14\" PVM (PVM-14M2U class, the canonical mid-90s Trinitron broadcast monitor). 0.25 mm aperture grille pitch per crtdatabase + Sony service manual class. Previous 0.45 mm was a transcription error from an undated source; PVM-class never had a pitch that coarse."
    }
  },

  "phosphor": {
    "type": "P22",
    "decay_ms": { "r": 1.0, "g": 0.080, "b": 0.080 },
    "chromaticity_smpte_c": {
      "r": [0.630, 0.340],
      "g": [0.310, 0.595],
      "b": [0.155, 0.070]
    },
    "source": {
      "url": "https://crtdatabase.com/faq/phosphor-designations",
      "retrieved_at": "2026-05-26"
    }
  },

  "beam": {
    "focus": 0.85,
    "intensity_curve": "gauss",
    "scanline_strength": 0.70,
    "interlace_mode": "off"
  },

  "glass": {
    "age": 0.0,
    "tint": [1.00, 1.00, 1.00],
    "reflection_strength": 0.05
  },

  "ageing": {
    "phosphor_burn_in": 0.0,
    "purity_drift": 0.0,
    "geometry_warp": 0.0
  },

  "h_freq_khz": 15.734,
  "v_freq_hz": 59.94
}
