{
  "$schema": "../../schemas/crt_profile.schema.json",
  "id": "pvm-20m4",
  "display_name": "Sony PVM-20M4 (20\" Trinitron, late 1990s)",
  "era": "1996",

  "tube": {
    "mask_type": "aperture_grille",
    "dot_pitch_mm": null,
    "screen_curvature": "flat",
    "diagonal_inches": 20,
    "aspect_native": "4:3",
    "source": {
      "url": "https://www.scribd.com/document/702806886/Sony-PVM-20M2-20M4-Service-Manual",
      "retrieved_at": "2026-05-26",
      "notes": "Service manual exists on Scribd with paywall partial. Dot pitch numerical value NEEDS-MEASUREMENT — value left null until service manual can be accessed in full. PVM-2030 (also 20\") has 0.55 mm so 0.50-0.55 mm is the expected range."
    }
  },

  "phosphor": {
    "type": "P22",
    "decay_ms": { "r": 1.0, "g": 0.080, "b": 0.080 },
    "chromaticity_smpte_c": {
      "r": [0.630, 0.340],
      "g": [0.310, 0.595],
      "b": [0.155, 0.070]
    },
    "source": {
      "url": "https://crtdatabase.com/faq/phosphor-designations",
      "retrieved_at": "2026-05-26"
    }
  },

  "beam": {
    "focus": 0.92,
    "intensity_curve": "gauss",
    "scanline_strength": 0.72,
    "interlace_mode": "off"
  },

  "glass": {
    "age": 0.0,
    "tint": [1.00, 1.00, 1.00],
    "reflection_strength": 0.03
  },

  "ageing": {
    "phosphor_burn_in": 0.0,
    "purity_drift": 0.0,
    "geometry_warp": 0.0
  },

  "h_freq_khz": 15.734,
  "v_freq_hz": 59.94
}
