{
  "$schema": "../../schemas/crt_profile.schema.json",
  "id": "sony-bvm-20f1u",
  "display_name": "Sony BVM-20F1U (20\" Broadcast Trinitron, 1995)",
  "era": "1995",

  "tube": {
    "mask_type": "aperture_grille",
    "dot_pitch_mm": 0.30,
    "screen_curvature": "flat",
    "diagonal_inches": 20,
    "aspect_native": "4:3",
    "source": {
      "url": "https://www.manualslib.com/manual/262577/Sony-Trinitron-Bvm-20f1u-Bvm-20f1e-Bvm-20e1u-Bvm-20e1e-Bvm-14f1u-Bvm-14f1e-Bvm-14e1u-Bvm-14e1e-Bvm-14f5u-Bvm-14f5e-Bvm-14e5.html?page=61",
      "retrieved_at": "2026-05-27",
      "notes": "Sony BVM-20F1U operation manual (page 61) — 20\" tube / 19\" viewable, 0.30 mm Super Fine Pitch Trinitron aperture grille, 30.6mm in-line gun, 90° deflection. 525/60i (15.734 kHz) and 625/50i (15.625 kHz) broadcast formats. Native 4:3 with switchable 16:9 via mask swap. Requires BKM-10R/11R controller. Multistandard horizontal up to ~64 kHz when fed PC signals."
    }
  },

  "phosphor": {
    "type": "P22",
    "decay_ms": { "r": 1.0, "g": 2.0, "b": 1.0 },
    "chromaticity_smpte_c": {
      "r": [0.630, 0.340],
      "g": [0.310, 0.595],
      "b": [0.155, 0.070]
    },
    "source": {
      "url": "https://crtdatabase.com/faq/phosphor-designations",
      "retrieved_at": "2026-05-26"
    }
  },

  "beam": {
    "focus": 0.97,
    "intensity_curve": "gauss",
    "scanline_strength": 0.72,
    "interlace_mode": "off"
  },

  "glass": {
    "age": 0.0,
    "tint": [1.00, 1.00, 1.00],
    "reflection_strength": 0.02
  },

  "ageing": {
    "phosphor_burn_in": 0.0,
    "purity_drift": 0.0,
    "geometry_warp": 0.0
  },

  "h_freq_khz": 15.734,
  "v_freq_hz": 59.94
}
