{
  "$schema": "../../schemas/crt_profile.schema.json",
  "id": "terminal-p3-amber",
  "display_name": "Monochrome Terminal — P3 amber (IBM 5151 / HP class)",
  "era": "1983",

  "tube": {
    "mask_type": "none",
    "dot_pitch_mm": null,
    "screen_curvature": "mild",
    "diagonal_inches": 12,
    "aspect_native": "4:3",
    "source": {
      "url": "https://en.wikipedia.org/wiki/Phosphor",
      "retrieved_at": "2026-05-26",
      "notes": "Amber monochrome CRT (P3 phosphor); typical of IBM 5151, HP, and Wyse terminals 1982-1990. dot_pitch_mm is N/A for monochrome."
    }
  },

  "phosphor": {
    "type": "P3",
    "decay_ms": { "r": 13.0, "g": 13.0, "b": 13.0 },
    "chromaticity_smpte_c": {
      "r": [0.523, 0.469],
      "g": [0.523, 0.469],
      "b": [0.523, 0.469]
    },
    "source": {
      "url": "https://en.wikipedia.org/wiki/Phosphor",
      "retrieved_at": "2026-05-27",
      "notes": "P3 = Zn8:BeSi5O19:Mn (Zn-Be silicate Mn-activated). Yellow-amber emission at 602 nm peak, EIA medium-persistence ~13 ms. Wikipedia phosphor table gives xy (0.523, 0.469); corrected from previous averaged (0.560, 0.430). Used in IBM 5151 amber, DEC VR201 amber, Wyse 50 amber. EIA TEP-116 paywalled — exact batch chromaticity ±0.02 tolerance."
    }
  },

  "beam": {
    "focus": 0.70,
    "intensity_curve": "gauss",
    "scanline_strength": 0.75,
    "interlace_mode": "off"
  },

  "glass": {
    "age": 0.10,
    "tint": [1.00, 0.95, 0.85],
    "reflection_strength": 0.08
  },

  "ageing": {
    "phosphor_burn_in": 0.0,
    "purity_drift": 0.0,
    "geometry_warp": 0.0
  },

  "h_freq_khz": 15.72,
  "v_freq_hz": 60.0
}
