{
  "$schema": "../../schemas/crt_profile.schema.json",
  "id": "wells-gardner-k7000",
  "display_name": "Wells-Gardner K7000 (13\" arcade raster, 1980s-90s)",
  "era": "1985",

  "tube": {
    "mask_type": "shadow",
    "dot_pitch_mm": 0.65,
    "screen_curvature": "mild",
    "diagonal_inches": 13,
    "aspect_native": "4:3",
    "source": {
      "url": "https://wellsgardner.com/wp-content/uploads/2016/08/K7000-1.pdf",
      "retrieved_at": "2026-05-26",
      "notes": "K7000 service manual PDF (~7-9 MB) hosts the dot pitch table; remote fetch hit size limits. Estimated 0.43-0.50 mm based on arcade-class CRTs of the era. NEEDS-MEASUREMENT against the printed manual."
    }
  },

  "phosphor": {
    "type": "P22",
    "decay_ms": { "r": 1.0, "g": 0.080, "b": 0.080 },
    "chromaticity_smpte_c": {
      "r": [0.630, 0.340],
      "g": [0.310, 0.595],
      "b": [0.155, 0.070]
    },
    "source": {
      "url": "https://crtdatabase.com/faq/phosphor-designations",
      "retrieved_at": "2026-05-26"
    }
  },

  "beam": {
    "focus": 0.78,
    "intensity_curve": "gauss",
    "scanline_strength": 0.55,
    "interlace_mode": "off"
  },

  "glass": {
    "age": 0.10,
    "tint": [1.00, 0.99, 0.97],
    "reflection_strength": 0.10
  },

  "ageing": {
    "phosphor_burn_in": 0.0,
    "purity_drift": 0.0,
    "geometry_warp": 0.0
  },

  "h_freq_khz": 15.72,
  "v_freq_hz": 60.0
}
