{
  "$schema": "../../schemas/crt_profile.schema.json",
  "id": "pvm-8220",
  "display_name": "Sony PVM-8220 (8\" Trinitron, 1985)",
  "era": "1985",

  "tube": {
    "mask_type": "aperture_grille",
    "dot_pitch_mm": 0.30,
    "screen_curvature": "flat",
    "diagonal_inches": 8,
    "aspect_native": "4:3",
    "source": {
      "url": "https://crtdatabase.com/crts/sony/sony-pvm-8220",
      "retrieved_at": "2026-05-26"
    }
  },

  "phosphor": {
    "type": "P22",
    "decay_ms": { "r": 1.0, "g": 0.080, "b": 0.080 },
    "chromaticity_smpte_c": {
      "r": [0.630, 0.340],
      "g": [0.310, 0.595],
      "b": [0.155, 0.070]
    },
    "source": {
      "url": "https://www.epanorama.net/documents/video/phosphor_decay.html",
      "retrieved_at": "2026-05-26",
      "notes": "P22 R decay range ~100us-1ms across phosphor variants; representative 1.0 ms chosen. SMPTE-C primaries from crtdatabase.com/faq/phosphor-designations."
    }
  },

  "beam": {
    "focus": 0.90,
    "intensity_curve": "gauss",
    "scanline_strength": 0.70,
    "interlace_mode": "off"
  },

  "glass": {
    "age": 0.0,
    "tint": [1.00, 1.00, 1.00],
    "reflection_strength": 0.03
  },

  "ageing": {
    "phosphor_burn_in": 0.0,
    "purity_drift": 0.0,
    "geometry_warp": 0.0
  },

  "h_freq_khz": 15.734,
  "v_freq_hz": 59.94
}
