{
  "$schema": "../../schemas/crt_profile.schema.json",
  "id": "terminal-p31",
  "display_name": "Monochrome Terminal — P31 green (Apple II / VT100 class)",
  "era": "1980",

  "tube": {
    "mask_type": "none",
    "dot_pitch_mm": null,
    "screen_curvature": "mild",
    "diagonal_inches": 12,
    "aspect_native": "4:3",
    "source": {
      "url": "https://en.wikipedia.org/wiki/Phosphor",
      "retrieved_at": "2026-05-26",
      "notes": "Monochrome CRT — single P31 phosphor, no shadow mask. Tube geometry approximates typical 12\" Apple II / Commodore PET / VT100 terminal hardware of the era. dot_pitch_mm is N/A for monochrome (single phosphor layer)."
    }
  },

  "phosphor": {
    "type": "P31",
    "decay_ms": { "r": 0.04, "g": 0.04, "b": 0.04 },
    "chromaticity_smpte_c": {
      "r": [0.226, 0.555],
      "g": [0.226, 0.555],
      "b": [0.226, 0.555]
    },
    "source": {
      "url": "https://en.wikipedia.org/wiki/Phosphor",
      "retrieved_at": "2026-05-27",
      "notes": "P31 = ZnS:Cu or ZnS:Cu,Ag — yellowish-green, ~525 nm peak, short persistence 0.01-1 ms (EIA TEP-116 range; typical ~38 µs). CIE 1931 xy (0.226, 0.555) per Wikipedia phosphor table — corrected from previous (0.260, 0.530) which was an averaged value. Used in oscilloscopes and computer monochrome monitors (Apple Monitor III, VT100 green variants). Note: IBM 5151 is actually P39 high-persistence green, not P31 — but P31 is the dominant green-terminal phosphor of the era."
    }
  },

  "beam": {
    "focus": 0.72,
    "intensity_curve": "gauss",
    "scanline_strength": 0.78,
    "interlace_mode": "off"
  },

  "glass": {
    "age": 0.05,
    "tint": [0.95, 1.00, 0.95],
    "reflection_strength": 0.08
  },

  "ageing": {
    "phosphor_burn_in": 0.0,
    "purity_drift": 0.0,
    "geometry_warp": 0.0
  },

  "h_freq_khz": 15.72,
  "v_freq_hz": 60.0
}
